{
  "schema_version": 1,
  "generated_for": "Llobregat Express demand model",
  "shippers": [
    {
      "shipper_id": "S-01",
      "name": "Fil de Lluna Moda",
      "segment": "e-commerce retailer",
      "description": "Online fashion retailer for women and men that ships from a national warehouse in central Spain.",
      "share_of_daily_parcels": 0.06,
      "parcel_mix": {"small": 0.82, "medium": 0.16, "large": 0.02},
      "same_day_share": 0.0,
      "recipient_type": "consumer",
      "business_share": 0.0,
      "arrives_at_hub": "overnight linehaul",
      "business_recipient_zones": []
    },
    {
      "shipper_id": "S-02",
      "name": "Casa Fanalet",
      "segment": "e-commerce retailer",
      "description": "Online home-goods store selling lamps, kitchenware and flat-pack small furniture.",
      "share_of_daily_parcels": 0.028,
      "parcel_mix": {"small": 0.2, "medium": 0.42, "large": 0.38},
      "same_day_share": 0.0,
      "recipient_type": "consumer",
      "business_share": 0.0,
      "arrives_at_hub": "overnight linehaul",
      "business_recipient_zones": []
    },
    {
      "shipper_id": "S-03",
      "name": "Circuit Blau",
      "segment": "e-commerce retailer",
      "description": "Online consumer-electronics shop selling headphones, small appliances, gaming gear and accessories.",
      "share_of_daily_parcels": 0.036,
      "parcel_mix": {"small": 0.58, "medium": 0.32, "large": 0.1},
      "same_day_share": 0.0,
      "recipient_type": "mixed",
      "business_share": 0.06,
      "arrives_at_hub": "overnight linehaul",
      "business_recipient_zones": ["Z02", "Z04", "Z09"]
    },
    {
      "shipper_id": "S-04",
      "name": "Llibres Pedrablanca",
      "segment": "e-commerce retailer",
      "description": "Online bookshop sending books, comics and board games from a warehouse near Madrid.",
      "share_of_daily_parcels": 0.02,
      "parcel_mix": {"small": 0.88, "medium": 0.11, "large": 0.01},
      "same_day_share": 0.0,
      "recipient_type": "consumer",
      "business_share": 0.0,
      "arrives_at_hub": "overnight linehaul",
      "business_recipient_zones": []
    },
    {
      "shipper_id": "S-05",
      "name": "Bosquet Kids",
      "segment": "e-commerce retailer",
      "description": "Online toy and baby-products store with prams and car seats as its bulky lines.",
      "share_of_daily_parcels": 0.028,
      "parcel_mix": {"small": 0.44, "medium": 0.4, "large": 0.16},
      "same_day_share": 0.0,
      "recipient_type": "consumer",
      "business_share": 0.0,
      "arrives_at_hub": "overnight linehaul",
      "business_recipient_zones": []
    },
    {
      "shipper_id": "S-06",
      "name": "Rebost de Casa",
      "segment": "e-commerce retailer",
      "description": "Online pantry and household-consumables shop that ships ambient groceries from a warehouse in El Prat.",
      "share_of_daily_parcels": 0.032,
      "parcel_mix": {"small": 0.28, "medium": 0.46, "large": 0.26},
      "same_day_share": 0.26,
      "recipient_type": "consumer",
      "business_share": 0.0,
      "arrives_at_hub": "midday injection",
      "business_recipient_zones": []
    },
    {
      "shipper_id": "S-07",
      "name": "Sabatilla Nord",
      "segment": "e-commerce retailer",
      "description": "Online footwear retailer whose parcels are mostly single shoe boxes.",
      "share_of_daily_parcels": 0.028,
      "parcel_mix": {"small": 0.46, "medium": 0.5, "large": 0.04},
      "same_day_share": 0.0,
      "recipient_type": "consumer",
      "business_share": 0.0,
      "arrives_at_hub": "overnight linehaul",
      "business_recipient_zones": []
    },
    {
      "shipper_id": "S-08",
      "name": "Estel Cosmètica",
      "segment": "e-commerce retailer",
      "description": "Online beauty and skincare shop sending small, light boxes.",
      "share_of_daily_parcels": 0.04,
      "parcel_mix": {"small": 0.9, "medium": 0.09, "large": 0.01},
      "same_day_share": 0.0,
      "recipient_type": "consumer",
      "business_share": 0.0,
      "arrives_at_hub": "overnight linehaul",
      "business_recipient_zones": []
    },
    {
      "shipper_id": "S-09",
      "name": "Muntanya Viva Esports",
      "segment": "e-commerce retailer",
      "description": "Online outdoor and sports-equipment store selling clothing, footwear and camping gear.",
      "share_of_daily_parcels": 0.028,
      "parcel_mix": {"small": 0.5, "medium": 0.36, "large": 0.14},
      "same_day_share": 0.0,
      "recipient_type": "consumer",
      "business_share": 0.0,
      "arrives_at_hub": "overnight linehaul",
      "business_recipient_zones": []
    },
    {
      "shipper_id": "S-10",
      "name": "Cua Feliç Mascotes",
      "segment": "e-commerce retailer",
      "description": "Online pet-supplies shop whose large food sacks and litter make up a big share of its parcels.",
      "share_of_daily_parcels": 0.028,
      "parcel_mix": {"small": 0.3, "medium": 0.36, "large": 0.34},
      "same_day_share": 0.0,
      "recipient_type": "consumer",
      "business_share": 0.0,
      "arrives_at_hub": "morning injection",
      "business_recipient_zones": []
    },
    {
      "shipper_id": "S-11",
      "name": "Nit Clara Llar",
      "segment": "e-commerce retailer",
      "description": "Online bedding and home-textiles retailer selling duvets, pillows and towels.",
      "share_of_daily_parcels": 0.022,
      "parcel_mix": {"small": 0.36, "medium": 0.5, "large": 0.14},
      "same_day_share": 0.0,
      "recipient_type": "consumer",
      "business_share": 0.0,
      "arrives_at_hub": "overnight linehaul",
      "business_recipient_zones": []
    },
    {
      "shipper_id": "S-12",
      "name": "Mercat Veloç Sellers Hub",
      "segment": "marketplace seller",
      "description": "Shared fulfilment unit in the Zona Franca that packs orders for about 300 small marketplace sellers who buy same-day delivery.",
      "share_of_daily_parcels": 0.039,
      "parcel_mix": {"small": 0.68, "medium": 0.26, "large": 0.06},
      "same_day_share": 0.26,
      "recipient_type": "consumer",
      "business_share": 0.0,
      "arrives_at_hub": "midday injection",
      "business_recipient_zones": []
    },
    {
      "shipper_id": "S-13",
      "name": "Armari Segona Vida",
      "segment": "marketplace seller",
      "description": "Second-hand fashion reseller in Sant Antoni that lists on several marketplaces.",
      "share_of_daily_parcels": 0.016,
      "parcel_mix": {"small": 0.86, "medium": 0.13, "large": 0.01},
      "same_day_share": 0.24,
      "recipient_type": "consumer",
      "business_share": 0.0,
      "arrives_at_hub": "midday injection",
      "business_recipient_zones": []
    },
    {
      "shipper_id": "S-14",
      "name": "Mòbil Recanvi Express",
      "segment": "marketplace seller",
      "description": "Seller of refurbished phones, cases and chargers that ships from a small workshop in L'Hospitalet.",
      "share_of_daily_parcels": 0.014,
      "parcel_mix": {"small": 0.93, "medium": 0.07, "large": 0.0},
      "same_day_share": 0.27,
      "recipient_type": "consumer",
      "business_share": 0.0,
      "arrives_at_hub": "midday injection",
      "business_recipient_zones": []
    },
    {
      "shipper_id": "S-15",
      "name": "Test i Planta",
      "segment": "marketplace seller",
      "description": "Local online plant and pot shop in Gràcia that offers same-day delivery of indoor plants.",
      "share_of_daily_parcels": 0.01,
      "parcel_mix": {"small": 0.25, "medium": 0.5, "large": 0.25},
      "same_day_share": 0.27,
      "recipient_type": "consumer",
      "business_share": 0.0,
      "arrives_at_hub": "midday injection",
      "business_recipient_zones": []
    },
    {
      "shipper_id": "S-16",
      "name": "Papereria Tinter",
      "segment": "marketplace seller",
      "description": "Neighbourhood stationery and gift shop in the Eixample that sells online with same-day delivery.",
      "share_of_daily_parcels": 0.01,
      "parcel_mix": {"small": 0.76, "medium": 0.21, "large": 0.03},
      "same_day_share": 0.26,
      "recipient_type": "consumer",
      "business_share": 0.0,
      "arrives_at_hub": "midday injection",
      "business_recipient_zones": []
    },
    {
      "shipper_id": "S-17",
      "name": "Bici Àgil Recanvis",
      "segment": "marketplace seller",
      "description": "Online bike-parts and accessories shop in Poblenou that also supplies delivery riders.",
      "share_of_daily_parcels": 0.012,
      "parcel_mix": {"small": 0.6, "medium": 0.3, "large": 0.1},
      "same_day_share": 0.26,
      "recipient_type": "consumer",
      "business_share": 0.0,
      "arrives_at_hub": "midday injection",
      "business_recipient_zones": []
    },
    {
      "shipper_id": "S-18",
      "name": "La Capsa Regal",
      "segment": "marketplace seller",
      "description": "Local online gift-box and hamper shop that also sends corporate gifts to offices.",
      "share_of_daily_parcels": 0.012,
      "parcel_mix": {"small": 0.4, "medium": 0.5, "large": 0.1},
      "same_day_share": 0.27,
      "recipient_type": "mixed",
      "business_share": 0.2,
      "arrives_at_hub": "midday injection",
      "business_recipient_zones": ["Z02", "Z04", "Z09"]
    },
    {
      "shipper_id": "S-19",
      "name": "Colibrí Paquet Nacional",
      "segment": "partner network",
      "description": "National parcel network that subcontracts its Barcelona final-mile delivery to Llobregat Express.",
      "share_of_daily_parcels": 0.076,
      "parcel_mix": {"small": 0.64, "medium": 0.27, "large": 0.09},
      "same_day_share": 0.0,
      "recipient_type": "mixed",
      "business_share": 0.27,
      "arrives_at_hub": "overnight linehaul",
      "business_recipient_zones": ["Z01", "Z02", "Z03", "Z04", "Z06", "Z09", "Z10", "Z11", "Z12"]
    },
    {
      "shipper_id": "S-20",
      "name": "Gavina Courier Europa",
      "segment": "partner network",